{
  "schema_version": 1,
  "research_study_id": "research-wf-example",
  "study_signature": "sha256:aaaaaaaaaaaaaaaaaaaaaaaaaaaaaaaaaaaaaaaaaaaaaaaaaaaaaaaaaaaaaaaa",
  "aggregator_version": "4.0.0",
  "trace_id": "trace-wf-example",
  "study_mode": "walk_forward_certification",
  "timeframe": "5m",
  "strategy": {"kind": "strategy", "algorithm_id": "downtrend_reversal_only", "algorithm_version": "1.0.0", "source_hash": "sha256:bbbbbbbbbbbbbbbbbbbbbbbbbbbbbbbbbbbbbbbbbbbbbbbbbbbbbbbbbbbbbbbb"},
  "parameters": {"checkpoint_interval": 1024},
  "datasets": [
    {"dataset_id": "SHFE.AO2609.5m", "data_revision": "sha256:cccccccccccccccccccccccccccccccccccccccccccccccccccccccccccccccc", "independence_group": "SHFE.AO", "trading_day_count": 600, "range": {"warmup_from_bar_index": 0, "from_bar_index": 0, "to_bar_index": 20000}},
    {"dataset_id": "DCE.I2609.5m", "data_revision": "sha256:dddddddddddddddddddddddddddddddddddddddddddddddddddddddddddddddd", "independence_group": "DCE.I", "trading_day_count": 600, "range": {"warmup_from_bar_index": 0, "from_bar_index": 0, "to_bar_index": 20000}}
  ],
  "child_runs": [
    {"dataset_id": "SHFE.AO2609.5m", "run_id": "run-wf-train", "run_signature": "sha256:eeeeeeeeeeeeeeeeeeeeeeeeeeeeeeeeeeeeeeeeeeeeeeeeeeeeeeeeeeeeeeee", "role": "train_candidate", "fold_index": 0, "candidate_index": 0},
    {"dataset_id": "SHFE.AO2609.5m", "run_id": "run-wf-validation", "run_signature": "sha256:ffffffffffffffffffffffffffffffffffffffffffffffffffffffffffffffff", "role": "validation", "fold_index": 0},
    {"dataset_id": "SHFE.AO2609.5m", "run_id": "run-wf-stress", "run_signature": "sha256:1111111111111111111111111111111111111111111111111111111111111111", "role": "stress", "fold_index": 0, "scenario_id": "cost_2x"},
    {"dataset_id": "SHFE.AO2609.5m", "run_id": "run-wf-neighbor", "run_signature": "sha256:2222222222222222222222222222222222222222222222222222222222222222", "role": "neighbor", "fold_index": 0, "parameter_name": "checkpoint_interval", "neighbor_direction": "lower"}
  ],
  "walk_forward": {"train_trading_days": 252, "validation_trading_days": 63, "step_trading_days": 63, "search_space": [{"name": "checkpoint_interval", "type": "integer", "candidates": [512, 1024]}], "objectives": [{"metric": "total_return", "direction": "maximize"}], "constraints": [], "search": {"method": "grid", "budget": 2, "random_seed": 7}},
  "stress_test": {"suite_version": "1.0.0", "volume_participation_rate": 0.1},
  "statistical_validation": {"method_version": "1.0.0", "block_size_trading_days": 5, "iterations": 2000, "confidence_level": 0.95, "random_seed": 7, "holm_alpha": 0.05},
  "artifacts": {"out_of_sample_daily_returns": "research-studies/research-wf-example/out_of_sample_daily_returns.parquet", "stress_results": "research-studies/research-wf-example/stress_results.json", "statistical_evidence": "research-studies/research-wf-example/statistical_evidence.json"},
  "execution": {"signal_timing": "bar_close", "fill_timing": "next_bar_open"},
  "capital": {"initial_cash_i64": 10000000, "currency": "CNY", "money_scale": 100},
  "random_seed": 7,
  "aggregate": {"data_status": "exploratory", "walk_forward_fold_count": 10, "completed_walk_forward_fold_count": 10, "profitable_fold_ratio": 0.7, "out_of_sample_trade_count": 120, "parameter_stability": 0.75},
  "engine": {"engine_version": "1.0.0", "python_version": "3.14", "contract_version": "1.0.0"},
  "created_at": "2026-08-24T00:00:00Z"
}
